{
  "schema": "fw.mes.event/1",
  "event_id": "e0000000-0000-4000-8000-000000000009",
  "type": "execution.ended",
  "producer": {
    "kind": "millwright",
    "id": "4d5e6f70-8192-43a4-b5c6-d7e8f9011223",
    "epoch": "5e6f7081-92a3-44b5-86d7-e8f901122334",
    "seq": 9
  },
  "site_id": "5f0c1d2e-8a3b-4c5d-9e6f-0a1b2c3d4e5f",
  "machine_id": "8d7c6b5a-4f3e-4d2c-8b1a-0f9e8d7c6b5a",
  "occurred_at": "2026-10-22T09:15:02.123Z",
  "clock": {
    "synced": true,
    "boot_id": "4f1c2a9e7b3d5c60",
    "mono_ms": 123456789
  },
  "correlation": {
    "execution_id": "b1000000-0000-4000-8000-000000000001",
    "scan_id": null,
    "operator_session_id": "c1000000-0000-4000-8000-000000000001"
  },
  "source": {
    "app": "millwright",
    "version": "0.9.0",
    "record": "outbox:9"
  },
  "payload": {
    "outcome": "completed",
    "seconds": 412.6,
    "last_line": 1830,
    "S": [
      12000,
      8000
    ],
    "F": [
      1500,
      600
    ],
    "overrides": {
      "feed": 1.0,
      "rapid": 0.5,
      "spindle": 1.1
    }
  },
  "station_id": "1a2b3c4d-5e6f-4a7b-8c9d-0e1f2a3b4c5d"
}
