{
  "schema": "fw.mes.event/1",
  "event_id": "e0000000-0000-4000-8000-000000000902",
  "type": "execution.started",
  "producer": {
    "kind": "millwright",
    "id": "4d5e6f70-8192-43a4-b5c6-d7e8f9011223",
    "epoch": "5e6f7081-92a3-44b5-86d7-e8f901122334",
    "seq": 902
  },
  "site_id": "5f0c1d2e-8a3b-4c5d-9e6f-0a1b2c3d4e5f",
  "machine_id": "8d7c6b5a-4f3e-4d2c-8b1a-0f9e8d7c6b5a",
  "occurred_at": "2026-10-22T10:02:41.500Z",
  "clock": {
    "synced": true,
    "boot_id": "4f1c2a9e7b3d5c60",
    "mono_ms": 123456789
  },
  "correlation": {
    "execution_id": "b1000000-0000-4000-8000-000000000902",
    "scan_id": null,
    "operator_session_id": "c1000000-0000-4000-8000-000000000001"
  },
  "source": {
    "app": "millwright",
    "version": "0.9.0",
    "record": "outbox:902"
  },
  "payload": {
    "program_path": "/home/cnc/linuxcnc/nc_files/atc_pickdrop_8.ngc",
    "program_sha256": "3e7a1c9f5b2d8e4a6c0f1b3d5e7a9c2f4b6d8e0a1c3e5f7a9b2d4c6e8f0a1b3d",
    "run_file_sha256": null,
    "mode": "atc_check",
    "wcs": null,
    "bound_scan_ids": []
  },
  "station_id": "1a2b3c4d-5e6f-4a7b-8c9d-0e1f2a3b4c5d"
}
